{
  "checklist_id": "01_create_file_partition",
  "title": "Create File Partition",
  "description": "Steps to create a disjoint partition of files in the data/ folder",
  "items": [
    {
      "item_id": "1.1",
      "description": "Analyze data/ folder structure and file contents",
      "completed": false
    },
    {
      "item_id": "1.2",
      "description": "Identify logical groupings based on file similarity and patterns",
      "completed": false
    },
    {
      "item_id": "1.3",
      "description": "Create partition JSON files with titles and descriptions",
      "completed": false
    },
    {
      "item_id": "1.4",
      "description": "Validate partition coverage using confirm_acceptable_partition script",
      "completed": false
    },
    {
      "item_id": "1.5",
      "description": "Create entity ontology for each partition",
      "completed": false
    },
    {
      "item_id": "1.6",
      "description": "Create relationship ontology for each partition",
      "completed": false
    },
    {
      "item_id": "1.7",
      "description": "Update master entity ontology",
      "completed": false
    },
    {
      "item_id": "1.8",
      "description": "Update master relationship ontology",
      "completed": false
    }
  ]
}
